27;Secretaria de Estado da Assistencia e Desenvolvimento Social;3;Comendador Calaca;1399;predio;poco;Predio da Antiga LBA;57025-640;MACEIO;AL;gabinete.seades.gov@gmail.com;(82) 33152878; ;(82) 33151030;-9.657.678.982.820.010;-3.572.466.909.885.400;2;0;0;0;0;1;0;0;0; ;2;1;1;2;1;1;1;1;2;1;2017; ;1; ;0; ; ; ;1; ; ; ; ; ;1; ; ; ; ;1;1; ; ; ; ;1;1;1;0;Programa Criança Alagoana; ; ; ; ; ; ; ; ; ;0;0;0;0;0;0;0;0;0;0;1;0;0; ;0;0;0;0;1;0;0;1;0; ;0;0;0;0;0;0;1;0;0;0;0;0; ;0; ; ; ; ; ; ; ; ; ; ; ; ; ; ; ;0; ; ; ; ; ; ; ; ; ;0;1;1;1;0;0;1;0;1;0;0;0; ;Programa Criança Feliz, Programa Criança Alagoana, PAEFI, AEPETI, Programa Bolsa Família, Cadastro Único, Auxílio Emergencial;0; ; ; ; ; ; ; ;6;6;2;2;1;1;1;1;1;0;1;1;1;1;1;1;1;4;0;3;3;1;0;1;0;0;0;0;0;1;0;1;1;0;0;0;1;antecipação do cofinanciamento, entrega de 450 mil cestas básicas para os 102 municípios, convênio com instituição para atendimento à população em situação de rua, instalação de centro para recuperação pós covid;0;1;1;1;0; ;0;0; ;0; ;0; ;1;600;0; ;0; ;0; ;0; ;0; ;0; ; ; ;0; ; ; ; ;0; ; ; ; ;1; ;2;2;0; ;27;2; ;0;0;1;0;0;0;0;0;1;0;0;0;0;1;1;0;0;0;0;0;0;0;0;0;0;0;0;0;0;1;0;0;0;0;0;0;1;0;0;1;0;0;0;0;0;0;0;0;1;0;0;0;0; ; ; ; ; ; ; ; ; ; ; ; ; ; ; ; ; ; ; ; ; ; ; ; ; ; ; ; ; ;1;1;0;1;0;0;0;0;0;1;0;1;1;0;0;0;1; ; ; ;1;1;1;5;1;1;1;1;1;3;17;43; ;17; ;6;9;38; ;19;6;63; ; ; ; ; ; ; ; ; ; ; ; ; ; ; ; ; ; ; ; ; ; ; ; ; ; ; ; ; ; ; ; ; ; ; ; ; ; ; ; ; ; ; ; ; ; ; ; ; ; ; ; ; ; ; ; 
28;Secretaria de Estado da Inclusao E Assistência Social;32;Santa Luzia;680; ;São José; ;49015-190;ARACAJU;SE;gabinete@seias.se.gov.br;(79) 31794836; ;(79) 31797676;-10.920.228.765.195.800;-3.705.199.241.638.180;2;0;0;0;0;1;0;1;0; ;2;2;2;0;1;2;2;1;2;1; ;1;0; ;1;2012; ; ;1; ; ; ; ; ;1;1;0;0;1;0;0;0;0;1;0;1;1;1;0;Mão Amiga - cana e laranja;Cartão Mais Inclusão; ; ; ; ; ; ; ; ;0;1;0;0;1;0;0;1;0;1;1;1;0; ;0;0;1;0;0;0;0;0;1;Comunicação com o ministério, funcionalidade e usabilidade dos sistemas;1;0;0;0;0;0;0;0;0;0;0;0; ;0; ; ; ; ; ; ; ; ; ; ; ; ; ; ; ;1;1;0;1;0;1;0;0;0;0;1;0;1;1;1;1;1;0;1;1;1;0; ;Serviço de Proteção em situação de calamidades públicas e emergências, Apoio Técnico Intersetorial para as unidade de acolhimento para mulheres em situação violência, Fortalecimento da agenda intersetorial de enfrentamento ao do Trabalho Infantil, Workshop o lugar do brincar na Primeira Infância, Sistemas da Rede SUAS (Prontuário, E-PCF, SISC, SIMPETI, CADSUAS e SAA, CADÚNICO, SIBEC, SIGPBF) PAIF, PAEFI, PCF, ACOLHIMENTO, VIGILÂNCIA SOCIOASSCIAL, AVALIAÇÃO E MONITORAMENTO, MEDIDAS SOCIOEDUCATIVAS, TRABALHO INFANTIL, SCFV NA PANDEMIA, GESTÃO DE CRAS);0; ; ; ; ; ; ; ;6;6;2;2;1;1;1;1;1;1;1;1;1;0;1;0;1;3;0;2;2;1;1;1;1;1;0;0;0;1;0;0;1;0;0;1;0; ;0;1;1;1;0; ;2;0; ;0; ;0; ;0; ;0; ;0; ;0; ;0; ;0; ;0; ; ; ;0; ; ; ; ;0; ; ; ; ;1; ;0;0;0; ;28;2; ;0;0;1;0;0;0;0;0;1;1;0;0;1;0;0;0;0;1;0;0;1;0;0;1;0;0;1;0;1;1;1;0;0;0;1;0;0;0;0;0;1;0;1;0;0;0;0;0;0;0;0;0;0; ; ; ; ; ; ; ; ; ; ; ; ; ; ;1;0;1;0;1;0;0;0;0; ; ; ; ; ; ;0;1;1;1;1;1;0;0;0;1;0;0;1;0;0;1;0; ; ; ;1;1;1;1;1;1;1;1;1; ;10;12; ;8; ;1; ;3; ;13;6;22; ; ; ; ; ; ; ; ; ; ; ; ; ; ; ; ; ; ; ; ; ; ; ; ; ; ; ; ; ; ; ; ; ; ; ; ; ; ; ; ; ; ; ; ; ; ; ; ; ; ; ; ; ; ; ; 
29;SECRETARIA DE JUSTIÇA, DIREITOS HUMANOS E DESENVOLVIMENTO SOCIAL;3;LUIS VIANA FILHO;390;PLATAFORMA IV, 1º ANDAR;CENTRO ADMINISTRATIVO DA BAHIA;Prédio da Governadoria;41745-005;SALVADOR;BA;gabinete@sjdhds.ba.gov.br;(71) 31156184;0;(71) 00000000;-12.950.130.005.649.100;-3.843.457.460.403.440;2;0;0;0;0;1;0;1;1;Pessoa com deficiência, política de drogas, Fundac e Procon;2;2;2;2;2;1;1;1;2;2; ;1;0; ;0; ; ; ;1; ; ; ; ; ;1; ; ; ; ;1;1; ; ; ; ;0;0; ; ; ; ; ; ; ; ; ; ; ; ;0;1;1;0;0;0;0;1;0;0;1;1;1;Sala virtual de escuta e reuniões virtuais de introdução a gestão;0;1;0;0;0;1;0;1;0; ;1;1;1;1;0;0;0;0;0;0;0;0; ;1;0;1; ;12;1;0;1;0;0;0;0;1;1;0; ;1;1;0;0;0;1;0;0;0;0;1;0;1;1;1;1;0;0;1;1;0;0; ;Encontro de Orientação Geral do SUAS, Planos e Planejamento no SUAS, Demonstrativo 2020 no SIACOF, Orientação Técnica para utilização do SAEPE, Seminário on line Proteja Bahia 2021, Projeto Viver - Abuso Sexual, O Cenário da Violência/Violação de direitos contra crianças e adolescentes, Seminário Online Proteja Bahia 2021 - O fluxo do atendimento a Crianças e Adolescentes em situação de violência sexual ,Orientações do CEAS-BA sobre as Conferências Municipais de Assistências Social,Seminário Virtual Proteja Bahia 2021 - Estratégias de implantação de escuta especializada e depoimento especial,Seminário Virtual Proteja Bahia 2021 - A rede fortalecida no enfrentamento à violência sexual - conexões possíveis,Seminário Virtual Proteja Bahia 2021 - A rede fortalecida no enfrentamento ao trabalho infantil - conexões possíveis,Seminário Virtual Proteja Bahia 2021 - O trabalho Infantil no contexto da pandemia,,Seminário Virtual Proteja Bahia 2021 - Agenda de Convergência '' Proteja Bahia'' - O e;1;1;1;1;0;1;SCFV;2;6;6;2;2;1;1;1;1;1;1;1;1;1;1;1;1;1;13;0;7;7;0;1;1;1;0;0;0;1;1;1;1;1;1;0;1;0; ;0;1;1;1;0; ;1;1;40;0; ;1;317;0; ;0; ;0; ;0; ;0; ;317; ;0; ; ; ;0; ; ; ; ;0; ; ; ; ;1; ;2;2;0; ;29;2; ;0;0;1;0;0;0;0;0;1;0;0;0;0;1;1;0;0;0;0;0;1;1;0;0;0;0;1;0;0;1;1;1;0;1;0;0;0;1;0;1;0;0;1;1;1;1;0;0;0;0;0;0;0;0;1; ;12;1;0;1;0;0;0;0;1;1;0;1;0;0;0;1;0;0;0;0;1;1;1;0;1;2;1;0;1;1;1;0;0;0;1;1;1;1;1;1;0;1;0; ; ; ;4;1;4;1;1;1;1;1;4; ;8;36;8;9; ;2;4;7; ;26;11;44; ; ; ; ; ; ; ; ; ; ; ; ; ; ; ; ; ; ; ; ; ; ; ; ; ; ; ; ; ; ; ; ; ; ; ; ; ; ; ; ; ; ; ; ; ; ; ; ; ; ; ; ; ; ; ; 
31;SUBSECRETARIA DE ESTADO DE ASSISTENCIA SOCIAL - SUBAS;31;Papa João Paulo II;4143;14º andar - Prédio Minas;SERRA VERDE;Cidade Administrativa Presidente Tancredo Neves;30630-900;BELO HORIZONTE;MG;gabinetesec@social.mg.gov.br;(31) 39168044; ;(31) 39168044;-19.781.847.830.952.000;-43.951.106.071.472.100;2;0;0;0;1;1;1;1;1;Esportes e Políticas sobre Drogas;1;1;1;1;1;1;1;1;1;0;2011; ;0; ;0; ; ; ;1;1;0;1;0;0;0;1;0;0;0;0;1; ; ; ; ;0;1;1;1;Auxílio Emergencial Mineiro;Aproximação SUAS; ; ; ;Rede Cuidar; ; ; ; ;0;1;1;1;1;0;0;1;0;1;1;1;0; ;0;0;0;0;0;1;0;1;0; ;1;0;0;0;0;1;1;1;1;0;0;0; ;1;1;1;5;4;1;0;1;1;1;1;1;0;1;0; ;0; ; ; ; ; ; ; ; ; ;1;0;1;1;1;1;1;0;1;1;1;0; ;Introdução à gestão do SUAS, Financiamento no SUAS, Educação Permanente no SUAS, A rede socioassistencial do SUAS, Principais sistemas de informação no SUAS, Formulários do Cadastro Único para entrevistadores, PAIF, Benefícios Eventuais, Atendimento à crianças e adolescentes vítimas de violência no SUAS, MSE, Serviços de Acolhimento, A atuação dos serviços da rede socioassistencial em situação de emergência e calamidade pública;0; ; ; ; ; ; ; ;6;6;2;2;1;1;1;1;1;1;1;1;0; ;1;1;1;10;0;5;5;1;0;1;0;0;0;0;0;1;1;1;1;0;1;0;0; ;0;1;1;0;0; ;1;0; ;1;53;0; ;1;1008;0; ;1;10;0; ;1;114;0; ;2;1; ;2014;0; ; ; ; ;0; ; ; ; ;1; ;3;5;0; ;31;3; ;0;0;1;1;0;1;0;0;0;1;0;0;0;0;1;0;0;0;0;0;1;1;1;1;0;0;1;0;1;1;1;0;0;0;0;0;0;1;0;1;0;0;1;0;0;0;0;1;1;1;1;0;0;1;1;5;4;1;0;1;1;1;1;1;0;1;0; ; ; ; ; ; ; ; ; ; ; ; ; ; ; ; ;1;0;1;0;0;0;0;0;1;1;1;1;0;1;0;0;1;2014; ;1;4;1;6;1;3;1;4;1;10;62;160;8;49; ;12;35;128;9;67;28;232; ; ; ; ; ; ; ; ; ; ; ; ; ; ; ; ; ; ; ; ; ; ; ; ; ; ; ; ; ; ; ; ; ; ; ; ; ; ; ; ; ; ; ; ; ; ; ; ; ; ; ; ; ; ; ; 
32;SECRETARIA DE ESTADO DE TRABALHO, ASSISTÊNCIA E DESENVOLVIMENTO SOCIAL;32;Dr João Carlos Souza;107;Ed Green Tower;Barro Vermelho;Rua da Divisão de Homicídios e Proteção à Pessoa DHPP, em frente ao MS Buffet;29057-530;VITORIA;ES;gabinete@setades.es.gov.br;(27) 36366821;6824;(27) 36366822;-20.292.831.685.977.800;-40.299.181.938.171.300;2;0;0;0;0;1;1;0;0; ;1;1;2;2;1;1;1;2;1;2;2012; ;0; ;0; ; ; ;1; ; ; ; ; ;1; ; ; ; ;1;0;0;0;1;0;1;1;1;1;Projeto Bolsa Capixaba;Programa Temporário de Transferência de Renda aos cidadãos atingidos social e economicamente pela pandemia do novo Coronavírus (COVID-19) - Cartão ES Solidário,; ; ; ;Programa Incluir;Projeto Pop Rua no âmbito do SUAS em resposta a Covid 19; ; ; ;0;1;1;1;1;1;0;1;1;1;1;1;0; ;0;0;0;0;0;0;0;0;1;Informações para orientar os municípios quanto ao Programa Auxílio Brasil, O governo federal tem demorado na divulgação das informações de modo geral, bem como na publicação do ?Informe Bolsa e Cadastro? que anteriormente antecedia os procedimentos adotados, relacionados à gestão do Cadastro Único e do Programa Bolsa Família,;1;0;0;0;0;1;0;0;0;0;1;0;Realização de Cofinanciamento emergencial no bloco PSE, complementar ao repasse regular, para o reforço, aprimoramento e adequação dos serviços prestados nos acolhimentos institucionais para Idosos e nas Residências Inclusivas, Criação do Programa Temporário de Transferência de Renda aos cidadãos atingidos social e economicamente pela pandemia do novo Coronavírus (COVID-19) - Cartão ES Solidário, Realização de extensão do cofinanciamento do Projeto Emergencial para atendimento à população em situação de rua, no contexto da pandemia do novo coronavírus - COVID-19, Revisão do Plano Estadual de contingenciamento para o enfrentamento da pandemia do novo coronavírus - COVID-19, Realização de apoios técnicos diversos, Previsão orçamentária de recursos financeiros destinados a emergências e calamidade pública,;0; ; ; ; ; ; ; ; ; ; ; ; ; ; ; ;1;0;0;0;1;0;0;0;0;0;0;1;1;1;1;1;1;1;1;1;1;1;Oficinas de Alinhamento,;Auxílio emergencial, Benefícios Eventuais, Cadastro Único e Programa Bolsa Família, IGD-M, Tarifa Social, CNH Social, BPC na Escola, Programa Estadual Incluir, SCFV, Trabalho Infantil, Enfrentamento a violência sexual contra crianças e adolescentes, População refugiada e migrante, Medidas Socioeducativas em Meio Aberto, Enfrentamento a violência contra mulher, Aporte financeiro emergencial PSE, Residência Inclusiva, Segurança Alimentar e Nutricional, Projeto Compra Direta de Alimentos, Vigilância Socioassistencial, Sistemas da Rede SUAS, Cofinanciamento Estadual Fundo a Fundo, Prestação de Contas, Gestão do Trabalho, PAIF, Promoção de Saúde Mental do Trabalhador do SUAS, Capacitação do Guia para Visita Domiciliar, Programa Criança Feliz, Oficina do Brincar, Primeira Infância,;0; ; ; ; ; ; ; ;6;6;2;2;1;1;1;1;1;1;1;1;1;1;1;1;1;6;0;6;6;0;0;1;0;0;0;0;1;1;1;1;1;1;1;1;1;Parceria com banco privado para atendimento com equipes, insumos e capacitação para o público pessoa idosa, pessoa com deficiência e pessoa em situação de rua, Instituiu o Programa Temporário de Transferência de Renda aos cidadãos atingidos social e economicamente pela pandemia do novo Coronavírus (COVID-19) - Cartão ES Solidário,;0;0;1;0;0; ;2;1;0;1;103;1;52;1;471;0; ;1;12;0; ;1;84;0; ;4;2; ;2009;0; ; ; ; ;0; ; ; ; ;1; ;3;2;0; ;32;3; ;0;0;1;0;0;0;0;0;1;0;0;0;0;1;0;0;0;1;0;0;1;1;1;1;1;0;1;1;1;1;1;0;0;0;0;0;0;0;0;0;1;0;1;0;0;0;0;1;0;0;0;0;1; ; ; ; ; ; ; ; ; ; ; ; ; ; ;0;0;0;1;0;0;0;0;0; ; ; ; ; ; ;1;0;0;1;0;0;0;0;1;1;1;1;1;1;1;1;1;2;2009; ;1;4;4;4;1;4;1;4;1;6;35;83;7;27;1;7;5;22; ;70;32;124;63;3;4;1;1;7;5;8; ;2;1;23; ; ; ; ; ;1;1;7; ;1;8; ;4;2; ; ; ; ; ; ; ; ; ; ;1; ;1;4; ; ;63;3;4;1;1;7;5;9;9;2;6;29; ; 
33;Secretaria de Estado de Desenvolvimento Social e Direitos Humanos do Rio de Janeiro;3;Erasmo Braga;118;9º andar;Centro;Ao lado da ALERJ;20020-000;RIO DE JANEIRO;RJ;subsuas.gab@sedsdh.rj.gov.br;(21) 23345551; ;-21;-2.290.474.097.860.760;-43.173.335.492.704.400;2;0;0;0;0;1;0;1;0; ;2;2;2;2;2;1;1;2;2;2;2018; ;1; ;0; ; ; ;1;0;0;0;1;0;0;1;0;0;0;0;0;0;0;1;0;1;1;1;0;SuperaRJ; ; ; ; ; ; ; ; ; ;0;1;0;1;1;0;0;0;0;1;1;1;0; ;0;0;0;0;0;0;0;1;0; ;1;0;0;0;0;0;0;1;1;0;0;0; ;0; ; ; ; ; ; ; ; ; ; ; ; ; ; ; ;0; ; ; ; ; ; ; ; ; ;0;1;1;1;0;0;1;0;1;1;0;0; ;Curso de Provimentos no CAPACITASUAS, Vigilância Socioassistencial, área finaneceira e orçamentária,;0; ; ; ; ; ; ; ;6;3;2;1;1;0;1;2;1;3;1;0;0; ;1;0;1;7;0;4;4;0;0;1;0;0;0;0;1;0;1;0;0;0;1;1;0; ;0;1;1;0;0; ;2;0; ;1;40;0; ;1;800;0; ;1;8;0; ;1;70; ;1;0; ; ; ;0; ; ; ; ;0; ; ; ; ;0; ;0;0;0; ;33;3; ;0;0;1;0;0;0;1;0;0;1;0;0;0;0;0;0;0;1;0;0;1;0;1;1;0;0;0;0;1;1;1;0;0;0;0;0;0;0;0;1;0;0;1;0;0;0;0;0;0;1;1;0;0; ; ; ; ; ; ; ; ; ; ; ; ; ; ; ; ; ; ; ; ; ; ; ; ; ; ; ; ; ; ;0;0;1;0;0;0;0;1;0;1;0;0;0;1;1;0; ; ; ;1;4;1;5;1;3;1;4;7;2;11;36;2;19; ;2;2;1; ;48; ;49;4;2;3;1; ;4;6;5;8;3; ;13; ; ; ; ; ;1; ;4; ;1; ; ; ; ; ; ; ; ; ; ; ; ; ; ; ; ; ; ; ; ;4;2;3;1; ;4;6;6;8;3; ;13; ; 
35;Secretaria de Desenvolvimento Social do Estado de São Paulo;32;BOA VISTA;170;3º ANDAR;CENTRO; ;01014-930;SAO PAULO;SP;celiaparnes@sp.gov.br;(11) 27638000;0;(11) 27638255;-23.546.127.001.547.400;-4.663.316.488.265.990;2;0;0;0;0;1;0;0;1;Drogas;1;1;0;0;1;1;1;2;2;2; ;1;0; ;0; ; ; ;1; ; ; ; ; ;1;1;0;0;0;0;1; ; ; ; ;1;1;1;1;Prospera Família /Prospera Jovem; Vale Gás;Renda Cidadã /Ação Jovem;SP Acolhe;Impulsiona SP;SP Amigo do Idoso / Projeto Longevidade;AcolheSP; ; ; ;0;0;0;0;0;0;0;0;1;1;1;1;0; ;0;0;0;0;0;1;0;1;0; ;1;0;1;1;0;1;1;0;1;1;0;0; ;0; ; ; ; ; ; ; ; ; ; ; ; ; ; ; ;1;0;0;0;1;1;0;0;0;0;0;1;1;1;1;1;1;1;1;1;1;0; ;Educação Permanente, Fundo a Fundo, Primeira Infância, Programa Criança Feliz, Papel do Estado no SUAS, SUAS para as Novas Gestões Municipais (introdução), Controle Social (Conselhos Estaduais e Municipais de Assistência e Desenvolvimento Social ? Assistência Social, Pessoa Idosa e Criança e Adolescente), SUAS em Tempos de COVID-19 ? Dados e informações sobre COVID-19 da Rede de Pesquisa Solidária, Situação da Mulher no Contexto da Pandemia, Violência contra a Mulher, Segurança Alimentar e Nutricional, Situação de Calamidade Pública e Emergência, Gestão do SUAS, LOAS, Serviços, benefícios, programas e projetos para Pessoa com Deficiência, CadÚnico, Programa Bolsa Família, Índice de Gestão Descentralizada Municipal (IGD-M), Benefício de Prestação Continuada (BPC), BPC na Escola, Longevidade, Violência contra Pessoas Idosas, Inclusão Produtiva ? Impulsiona SP, Benefícios Eventuais, Metodologias de Trabalho com as Famílias, Serviço de Proteção e Atendimento Integral à Família, Concepção d;1;1;1;1;0;1;adequação dos recursos humanos;9;6;6;2;2;1;1;1;1;1;1;1;1;1;1;1;1;1;11;0;11;11;0;0;1;1;0;0;0;0;0;1;1;1;0;1;0;0; ;0;1;1;1;1;Desde julho de 2021, trabalho presencial em jornada integral, mediante decreto governamental;1;1;119;1;1362;1;2251;1;2587;1;7;1;29;1;95;1;555;0; ;0; ; ; ;0; ; ; ; ;0; ; ; ; ;1; ;5;4;1;0;35;3; ;0;0;1;0;0;0;0;0;1;1;0;0;0;0;1;0;0;0;0;0;0;0;0;0;0;0;0;1;1;1;1;0;0;0;0;0;0;1;0;1;0;0;1;0;1;1;0;1;1;0;1;1;0; ; ; ; ; ; ; ; ; ; ; ; ; ; ;0;0;0;1;1;0;0;0;0;1;1;1;0;1;9;1;0;0;1;1;0;0;0;0;0;1;1;1;0;1;0;0; ; ;0;4;6;6;6;3;4;4;5;1;10;79;353;24;45; ;27;28;248;3;181;10;442; ; ; ; ; ; ; ; ; ; ; ; ; ; ; ; ; ; ; ; ; ; ; ; ; ; ; ; ; ; ; ; ; ; ; ; ; ; ; ; ; ; ; ; ; ; ; ; ; ; ; ; ; ; ; ; 
41;Secretaria de Estado da Justiça, Família e Trabalho - SEJUF;32;JACY LOUREIRO CAMPOS;0;PALACIO DAS ARAUCÁRIAS;CENTRO CÍVICO; ;80530-915;CURITIBA;PR;gabinete@seds.pr.gov.br;(41) 32102400;2711;-41;-25.414.923.434.786.700;-4.927.002.042.531.960;2;0;0;0;0;0;1;1;1;Justiça e Garantia de Direitos;1;2;2;2;1;1;1;1;2;2; ;1;0; ;1; ; ; ;1; ; ; ; ; ;1; ; ; ; ;1;1; ; ; ; ;1;1;1;0;Bolsa Agente Cidadania; ; ; ; ; ; ; ; ; ;0;1;0;1;0;0;0;0;0;1;1;1;0; ;0;1;0;1;0;0;0;1;0; ;1;0;1;0;1;1;1;0;0;0;0;0; ;1;0;1; ;23;1;1;0;0;0;0;1;0;1;0; ;1;0;0;0;1;0;0;0;0;0;1;1;1;1;0;0;0;0;1;1;0;0; ;Live - ver as temátias, Seminário MSG em meio aberto, Encontro com os OSC obre os serviços da PSE ppara pessoas idosas e com deficiência  e suas familias,;0; ; ; ; ; ; ; ;6;6;2;2;1;1;1;1;1;1;1;1;1;1;1;1;1;7;0;8;8;1;1;1;1;1;0;0;0;0;0;1;1;1;1;0;1;Repasse do beneficio COVID19,;0;1;1;0;0; ;97;1;100;1;98;1;1455;1;802;0; ;0; ;0; ;0; ;0; ;2;2; ;2002;0; ; ; ; ;0; ; ; ; ;1; ;0;4;0; ;41;4; ;0;0;1;0;0;0;0;0;1;0;0;0;0;1;1;0;0;0;0;0;1;0;1;0;0;0;0;0;1;1;1;0;0;1;0;1;0;0;0;1;0;0;1;0;1;0;1;1;1;0;0;0;0;0;1; ;23;1;1;0;0;0;0;1;0;1;0;0;0;0;1;0;0;0;0;0; ; ; ; ; ; ;1;1;1;1;1;1;0;0;0;0;0;1;1;1;1;0;1;2;2002; ;4;4;6;5;1;1;1;1;1;4;36;225;17;60; ;19;36;108;10;94;53;265; ; ; ; ; ; ; ; ; ; ; ; ; ; ; ; ; ; ; ; ; ; ; ; ; ; ; ; ; ; ; ; ; ; ; ; ; ; ; ; ; ; ; ; ; ; ; ; ; ; ; ; ; ; ; ; 
42;Secretaria de Estado de Desenvolvimento Social;32;Fúlvio Aducci;767; ;Estreito; ;88000-000;FLORIANOPOLIS;SC;gabinete@sst.sc.gov.br;(48) 36640773; ;-48;-27.589.820.776.384.200;-4.857.499.837.875.360;2;0;0;0;1;1;0;1;0; ;1;2;1;2;1;1;1;1;1;0; ;1;0; ;0; ; ; ;1; ; ; ; ; ;1;1;0;0;0;0;1; ; ; ; ;0;0; ; ; ; ; ; ; ; ; ; ; ; ;0;1;1;0;1;1;0;0;1;0;1;1;0; ;0;0;0;0;0;1;0;1;0; ;1;0;1;1;1;1;1;0;1;0;0;0; ;0; ; ; ; ; ; ; ; ; ; ; ; ; ; ; ;0; ; ; ; ; ; ; ; ; ;0;1;1;1;0;0;1;1;1;1;1;0; ;Normativas, legislações, apresentação da equipe estadual aos municípios, live sobre elaboração do plano municipal de assistência social, cofinanciamento estadual, gestão do trabalho na pandemia, educação permanente e a pandemia Covid-19, plano de contingência de assistência social, repasse de recursos federais para alta complexidade em período de calamidade, Web sobre PETI, medidas sócio educativas em meio aberto, proteção social básica e especial, gestão do território e o papel do coordenador do CRAS,retomada do SCFV, atendimento das comundades quilombolas pela PSB, capacitação da lei de benefícios eventuais, Capacitação do SIBEC, fluxo de atendimento a pessoa em situação de rua na pandemia,;0; ; ; ; ; ; ; ;6;6;2;2;1;1;1;1;1;1;1;1;1;1;1;1;1;10;2;6;6;1;1;1;1;1;0;0;0;1;1;1;1;0;1;1;0; ;0;1;1;0;0; ;1;0; ;1;10;0; ;1;3240;0; ;0; ;0; ;0; ;0; ;1;2; ;2016;0; ; ; ; ;0; ; ; ; ;1; ;6;4;0; ;42;4; ;0;0;1;0;0;0;0;0;1;1;0;0;0;0;1;0;0;0;0;0;1;1;0;1;1;0;0;1;0;1;1;0;0;0;0;0;0;1;0;1;0;0;1;0;1;1;1;1;1;0;1;0;0; ; ; ; ; ; ; ; ; ; ; ; ; ; ; ; ; ; ; ; ; ; ; ; ; ; ; ; ; ;1;1;1;1;1;1;0;0;0;1;1;1;1;0;1;1;0;2;2016; ;1;3;1;6;1;1;1;1;1; ;4;15;1;8; ; ;1;9; ;4;6;19; ; ; ; ; ; ; ; ; ; ; ; ; ; ; ; ; ; ; ; ; ; ; ; ; ; ; ; ; ; ; ; ; ; ; ; ; ; ; ; ; ; ; ; ; ; ; ; ; ; ; ; ; ; ; ; 
43;Secretaria de Igualdade, Cidadania, Direitos Humanos e Assistência Social;3;Av. Borges de Medeiros;1501;8º andar;Centro;Centro Administrativo do Estado do Rio Grande do Sul;90119-900;PORTO ALEGRE;RS;das@igualdade.rs.gov.br;(51) 32886400;6483;(51) 32886526;-30.040.770.758.545.100;-51.231.071.949.005.100;2;0;0;0;0;0;0;1;1;Igualdade, Cidadania;1;2;2;2;2;1;1;1;2;1; ;1;1; ;1;2021; ; ;1; ; ; ; ; ;1; ; ; ; ;1;1; ; ; ; ;0;1;1;0;Programa POP RUA RS;Devolve ICMS;Auxilio Emergencial de Apoio à Atividade Econômica e de Proteção Social; ; ; ; ; ; ; ;0;1;1;0;0;0;0;0;0;0;1;1;0; ;0;0;0;0;1;0;0;0;0; ;1;0;0;0;0;0;0;0;0;0;1;0;Nota técnica de orientação;0; ; ; ; ; ; ; ; ; ; ; ; ; ; ; ;0; ; ; ; ; ; ; ; ; ;1;0;1;1;0;1;1;0;1;1;1;0; ;Lei do Suas, Benefícios Eventuais, BPC na Escola, Gestão Finaceira, regulação do SUAS, CNEAS, Gestão do Cadúnico e PBF;0; ; ; ; ; ; ; ;6;6;2;2;1;1;1;1;1;1;1;1;1;1;1;1;1;9;0;5;5;1;0;0;1;0;0;0;0;0;1;1;1;0;0;0;1;POP RUA RS;0;1;1;0;0; ;1;0; ;0; ;0; ;1;206;0; ;0; ;0; ;0; ;0; ;0; ; ; ;0; ; ; ; ;0; ; ; ; ;1; ;0;0;0; ;43;4; ;0;0;1;0;0;0;0;0;1;0;0;0;0;1;1;0;0;0;0;0;1;1;0;0;0;0;0;0;0;1;1;0;0;0;0;0;1;0;0;0;0;0;1;0;0;0;0;0;0;0;0;0;1; ; ; ; ; ; ; ; ; ; ; ; ; ; ; ; ; ; ; ; ; ; ; ; ; ; ; ; ; ;1;1;0;0;1;0;0;0;0;0;1;1;1;0;0;0;1; ; ; ;1;1;1;4;1;1;1;1;1; ;5;44;1;28; ;2; ;41; ;7;1;49; ; ; ; ; ; ; ; ; ; ; ; ; ; ; ; ; ; ; ; ; ; ; ; ; ; ; ; ; ; ; ; ; ; ; ; ; ; ; ; ; ; ; ; ; ; ; ; ; ; ; ; ; ; ; ; 
50;SECRETARIA DE ESTADO DE DIREITOS HUMANOS, ASSISTÊNCIA SOCIAL E TRABALHO;3;DESEMBARGADOR JOSÉ NUNES DA CUNHA, BLOCO III;0; ;JARDIM VERANEIO; ;79031-310;CAMPO GRANDE;MS;sedhast@sedhast.ms.gov.br;(67) 33184100;4141;(67) 33184111;-20.452.508.102.404.900;-54.553.685.188.293.400;2;0;0;0;0;0;1;1;1;Procon;1;1;1;2;1;1;1;1;2;1;2016; ;0; ;1;2018; ; ;1; ; ; ; ; ;1;1;0;0;0;0;1; ; ; ; ;1;1;1;1;Mais Social;Vale Universidade;Vale Universidade Indígena; ; ;Passe Livre Intermunicipal; ; ; ; ;0;0;0;0;1;0;0;0;1;0;1;0;0; ;0;1;0;0;0;1;0;1;0; ;1;0;0;0;0;0;0;0;0;0;0;0; ;0; ; ; ; ; ; ; ; ; ; ; ; ; ; ; ;1;1;0;0;1;1;0;0;0;0;0;0;1;1;1;1;1;0;1;1;1;1;Observatório SUAS MS;Gestão do SUAS, Gestão dos Fundos, Gestão do Trabalho e Educação Permanente, Saúde do Trabalhador, Práticas Exitosas, Primeira Infância no SUAS, Escuta Especializada;1;1;1;0;0;1;Estruturação do órgão gestor;79;6;6;2;3;1;1;1;0;1;1;1;1;1;1;1;1;1;8;0;7;7;1;1;1;1;1;0;0;1;0;1;1;1;0;1;0;0; ;0;1;1;0;0; ;1;1;7;0; ;1;43;1;368;0; ;0; ;0; ;0; ;0; ;1;1; ;2013;0; ; ; ; ;0; ; ; ; ;1; ;4;2;0; ;50;5; ;0;0;1;0;0;0;0;0;1;1;0;0;0;0;1;0;0;0;0;0;0;0;0;1;0;0;0;1;0;1;0;0;0;1;0;0;0;1;0;1;0;0;1;0;0;0;0;0;0;0;0;0;0; ; ; ; ; ; ; ; ; ; ; ; ; ; ;1;0;0;1;1;0;0;0;0;1;1;0;0;1;79;1;1;1;1;1;1;0;0;1;0;1;1;1;0;1;0;0;1;2013; ;3;1;4;4;1;1;1;1;1;2;23;71;15;29; ; ;9;67; ;25;4;96; ; ; ; ; ; ; ; ; ; ; ; ; ; ; ; ; ; ; ; ; ; ; ; ; ; ; ; ; ; ; ; ; ; ; ; ; ; ; ; ; ; ; ; ; ; ; ; ; ; ; ; ; ; ; ; 
51;SECRETARIA DE ESTADO DE ASSISTÊNCIA SOCIAL E CIDADANIA;32;JOÃO DOMINGOS DE CAMPOS;100; ;CENTRO POLITICO ADMINISTRATIVO; ;78049-931;CUIABA;MT;saas@setasc.mt.gov.br;(65) 36135711; ;-65;-15.566.489.859.605.300;-5.607.415.437.698.360;2;0;0;0;0;0;1;1;1;Cidadania e Defesa do Consumidor;1;1;1;1;1;1;1;1;1;1; ;1;0; ;0; ; ; ;1; ; ; ; ; ;1; ; ; ; ;1;1; ; ; ; ;1;1;1;1;Ser Familia;Ser Criança 04 a 12 anos;Ser Familia Habitação; ; ;Aconchego; ; ; ; ;0;0;0;1;0;0;0;1;0;0;1;0;1;Orientação técnica atraves de videoconferencia, whats app e e-mails;0;0;0;0;0;1;1;0;1;Desatualização do VISDATA, Dificuldade no donwload da folha de pagamento do PBF e RI social (versão3), canais de comunicação instável (chat, 121,0800);1;0;0;0;0;0;0;0;0;0;0;0; ;0; ; ; ; ; ; ; ; ; ; ; ; ; ; ; ;0; ; ; ; ; ; ; ; ; ;0;1;0;1;0;0;1;0;1;1;0;0; ;Gestão e operacionalização do PCF, Gestão e operacionalização do PETI e Acessuas Trabalho, Viodeconferencia para os novos gestores do CadÚnico e PBF, Apoio técnico virtual aos novos gestores municipais do SUAS, Videoconferencia aos superviores e visitadores do PCFsobre o Guia de Visita Domiciliar, 1º Encontro Estadual de vigilancia socioassistencial, Web Encontro sobre o serviço especialiazdo em abordagem social, Web encontro estadual do E- PCF, Videoconferencia sobre SIPIA e SINASE,  Oficina de Aprendizagem SISC/RMA,  Capacitação online''Formulários do CadÚnico'', Treinamento SIBEC, Apoio Técnico Intersetorial: Municípios Prioritários - MUP's, campanha 12 de junho/2021: Precisamos agir agora para acabar com o trabalho infantil, Seminario estadual PCF: Compatilhando ideias para crescer, Lives: '' Experiencias exitosas do PCF nos municipios de Cuiaba, Lucas do Rio Verde, Santo Antonio do Leverger, Terra Nova do Norte, e TJMT, Cad Unico e tarifa social: Quem tem direito?, Auxílio Brasil;0; ; ; ; ; ; ; ;6;6;2;2;1;1;1;1;1;1;1;1;0; ;1;1;1;4;0;2;2;1;1;1;1;0;0;0;0;0;1;1;1;0;0;0;0; ;0;1;1;1;0; ;97;0; ;0; ;1;267;0; ;0; ;0; ;0; ;0; ;0; ;2;2; ;2011;0; ; ; ; ;0; ; ; ; ;1; ;8;5;0; ;51;5; ;0;0;1;0;0;0;0;0;1;0;0;0;0;1;1;0;0;0;0;0;0;0;1;0;0;0;1;0;0;1;0;1;0;0;0;0;0;1;1;0;1;0;1;0;0;0;0;0;0;0;0;0;0; ; ; ; ; ; ; ; ; ; ; ; ; ; ; ; ; ; ; ; ; ; ; ; ; ; ; ; ; ; ;1;1;1;1;0;0;0;0;0;1;1;1;0;0;0;0;2;2011; ;1;1;4;1;1;1;1;1;1; ;13;63;6;25; ;1;8;55; ;14;7;76; ; ; ; ; ; ; ; ; ; ; ; ; ; ; ; ; ; ; ; ; ; ; ; ; ; ; ; ; ; ; ; ; ; ; ; ; ; ; ; ; ; ; ; ; ; ; ; ; ; ; ; ; ; ; ; 
52;SECRETARIA DE ESTADO DE DESENVOLVIMENTO SOCIAL;27;Dr. Pedro Ludovico Teixeira;332;Blocos A, B, C, D;Centro; ;74003-010;GOIANIA;GO;suas@goias.gov.br;(62) 32018056; ;-62;-1.668.063.635.115.390;-4.925.486.326.217.650;2;0;0;0;0;0;1;1;1;MULHER, IGUALDADE RACIAL E SISTEMA SOCIOEDUCATIVOmu;1;1;1;0;1;1;1;1;2;1;2015; ;1; ;0; ; ; ;1;0;0;0;1;0;0;1;0;0;0;0;1; ; ; ; ;1;1;1;0;PROGRAMA MÃES DE GOIÁS/SEDS;PROGRAMA CRÉDITO SOCIAL/RETOMADA;PROGRAMA UNIVERSITÁRIO DO BEM/OVG;POLÍTICA PÚBLICA FOMENTO PRODUTIVO/ EMATER/GO; ; ; ; ; ; ;0;1;1;1;1;1;1;0;1;1;1;1;0; ;0;0;0;1;0;0;0;0;1;FALTA DE INFORMAÇÃO EM TEMPO HÁBIL PELO MINISTÉRIO DE CIDADANIA/SENARC SOBRE BLOQUEIOS E CANCELAMENTO DE BENFÍCIOS,  2 - RELATÓRIOS SISTEMATIZADOS POR PERÍODOS NO MI SOCIAL FORAM RETIRADOS DO PORTAL DE BUSCA, O QUE IMPOSSIBILITA O ACESSO A ESSES DADOS,    3 - OS CANAIS DE COMUNICAÇÃO DO MC DISPONIBILIZADOS AO BENEFICIÁRIO NÃO ATENDEM À DEMANDA DE SOLICITAÇÕES,;1;0;0;0;0;1;0;0;1;0;0;0; ;0; ; ; ; ; ; ; ; ; ; ; ; ; ; ; ;0; ; ; ; ; ; ; ; ; ;1;1;1;1;1;1;1;0;1;1;1;0; ;Acolhimento a novos gestores da Assistência social, (Gestão do SUAS, Planejamento e Regulação do SUAS, Vigilanciasocioassistencial e Gestão do Trabalho no SUAS), 2) Goiás pela diversidade ? formação permanente em direitos humanos, 3) Art,30 da LOAS (Processo de Averiguação dos CMAS e FMAS), 4) Tira dúvidas sobre execução dos recursos do SUAS, 5) WebnárioCenso SUAS 2021, 6) Simpósio goiano de enfrentamento ao abuso e a exploração sexual de crianças e adolescentes, 7) Encontro Intersetorial das Ações Estratégias do PETI, 8) O Registro Mensal de Atendimento ? RMA/ CRAS/CREAS e CENTRO POP, 9) Apoio técnico para Estruturação e Implementação de Vigilância Socioassistêncial, 10) Apoio técnico da SNAS e SEDS/GO(Gestão do SUAS (vigilância Sociassistencial e financiamento do SUAS), 11) Apoio técnico da SNAS e SEDS/GO (Proteção Social Básica), (Proteção Social Especial) e (Rede socioassistencialPrivada), 12) Auxílio emergencial para ILPIS, 13) As mudanças no BPC e os impactos na vida das pessoas;0; ; ; ; ; ; ; ;6;6;2;2;1;1;1;1;1;1;1;1;0; ;1;1;1;9;0;5;5;0;1;0;1;0;0;0;0;1;1;1;1;0;0;0;0; ;0;1;1;0;0; ;1;0; ;0; ;0; ;1;60;0; ;0; ;0; ;0; ;0; ;2;1; ;2010;0; ; ; ; ;0; ; ; ; ;1; ;0;0;0; ;52;5; ;0;0;1;0;0;0;1;0;0;1;0;0;0;0;1;0;0;0;0;0;1;1;1;1;1;1;0;1;1;1;1;0;0;0;0;1;0;0;0;0;1;0;1;0;0;0;0;1;0;0;1;0;0; ; ; ; ; ; ; ; ; ; ; ; ; ; ; ; ; ; ; ; ; ; ; ; ; ; ; ; ; ; ;0;1;0;1;0;0;0;0;1;1;1;1;0;0;0;0;1;2010; ;1;1;1;4;1;1;1;1;1; ;39;55;3;21; ;2;8;79;7;6;2;94; ; ; ; ; ; ; ; ; ; ; ; ; ; ; ; ; ; ; ; ; ; ; ; ; ; ; ; ; ; ; ; ; ; ; ; ; ; ; ; ; ; ; ; ; ; ; ; ; ; ; ; ; ; ; ; 
