IBGE;q0_1;q0_2;q0_3;q0_4;q0_5;q0_6;q0_7;q0_8;q0_9;q0_10;q0_11;q0_12;q0_13;q0_14;Latitude;Longitude;q1;q2_1;q2_2;q2_3;q2_4;q2_5;q2_6;q2_7;q2_99;q2_99_1;q3_1;q3_2;q3_3;q3_4;q3_5;q3_6;q3_7;q3_8;q3_9;q3_10;q4;q4_97;q5;q5_97;q6;q6_99;q7_1_1;q7_1_2;q7_1_0;q7_2_1;q7_2_2;q7_2_3;q7_2_4;q7_2_5;q7_2_0;q7_3_1;q7_3_2;q7_3_3;q7_3_4;q7_3_0;q8_0;q8_1;q8_2;q8_3;q8_4;q9;q10;q11_1;q11_2;q11_1_1;q11_1_2;q11_1_3;q11_1_4;q11_1_5;q11_2_1;q11_2_2;q11_2_3;q11_2_4;q11_2_5;q12_0;q12_1;q12_2;q12_3;q12_4;q12_5;q12_6;q12_7;q12_8;q12_9;q12_10;q12_11;q12_99;q12_99_1;q13_0;q13_1;q13_2;q13_3;q13_4;q13_5;q13_6;q13_7;q13_99;q13_99_1;q14_1;q14_2;q14_3;q14_4;q14_5;q14_6;q14_7;q14_8;q14_9;q14_10;q14_99;q14_0;q14_99_1;q15;q16_1;q16_2;q16_1_1;q16_2_1;q17_1;q17_2;q17_3;q17_4;q17_5;q17_6;q17_7;q17_8;q17_9;q17_99;q17_99_1;q18;q19_1;q19_2;q19_3;q19_4;q19_5;q19_6;q19_7;q19_8;q19_9;q20;q21_1;q21_2;q21_3;q21_4;q21_5;q21_6;q21_7;q21_8;q21_9;q21_10;q21_99;q21_99_1;q22;q23;q24_1;q24_2;q24_3;q24_4;q24_99;q24_99_1;q25;q26_1_1;q26_1_2;q26_2_1;q26_2_2;q26_3_1;q26_3_2;q26_4_1;q26_4_2;q26_5_1;q26_5_2;q26_6_1;q26_6_2;q27;q28;q29;q30;q31;q32;q33;q34;q35;q36_1;q36_2;q36_3;q36_4;q36_5;q36_0;q37_0;q37_1;q37_2;q37_3;q37_4;q37_5;q37_6;q37_7;q37_8;q37_99;q37_99_1;q38_1;q38_2;q38_3;q38_4;q38_99;q38_99_1;q39;q40_1;q40_1_99;q40_2;q40_2_99;q40_3;q40_3_99;q40_4;q40_4_99;q41_1;q41_1_99;q41_2;q41_2_99;q41_3;q41_3_99;q41_4;q41_4_99;q42;q42_98;q43;q44;q44_99_1;q45;q46_1_1;q46_1_2;q46_1_3;q46_1_4;q46_1_5;q46_2_1;q46_2_2;q46_2_3;q46_2_4;q46_2_5;q47;q48;q48_1_99;q48_2_99;q49;q50;UF;Regiao;Q_incompleto;q7_1_1_velha;q7_1_2_velha;q7_1_0_velha;q7_2_1_velha;q7_2_2_velha;q7_2_3_velha;q7_2_4_velha;q7_2_5_velha;q7_2_0_velha;q7_3_1_velha;q7_3_2_velha;q7_3_3_velha;q7_3_4_velha;q7_3_0_velha;q8_0_velha;q8_1_velha;q8_2_velha;q8_3_velha;q8_4_velha;q12_0_velha;q12_1_velha;q12_2_velha;q12_3_velha;q12_4_velha;q12_5_velha;q12_6_velha;q12_7_velha;q12_8_velha;q12_9_velha;q12_10_velha;q12_11_velha;q12_99_velha;q13_0_velha;q13_1_velha;q13_2_velha;q13_3_velha;q13_4_velha;q13_5_velha;q13_6_velha;q13_7_velha;q13_99_velha;q14_0_velha;q14_1_velha;q14_2_velha;q14_3_velha;q14_4_velha;q14_5_velha;q14_6_velha;q14_7_velha;q14_8_velha;q14_9_velha;q14_10_velha;q14_99_velha;q16_1_velha;q16_2_velha;q16_1_1_velha;q16_2_1_velha;q17_1_velha;q17_2_velha;q17_3_velha;q17_4_velha;q17_5_velha;q17_6_velha;q17_7_velha;q17_8_velha;q17_9_velha;q17_99_velha;q19_1_velha;q19_2_velha;q19_3_velha;q19_4_velha;q19_5_velha;q19_6_velha;q19_7_velha;q19_8_velha;q19_9_velha;q24_1_velha;q24_2_velha;q24_3_velha;q24_4_velha;q24_99_velha;q25_velha;q28_velha;q36_1_velha;q36_2_velha;q36_3_velha;q36_4_velha;q36_5_velha;q36_0_velha;q37_0_velha;q37_1_velha;q37_2_velha;q37_3_velha;q37_4_velha;q37_5_velha;q37_6_velha;q37_7_velha;q37_8_velha;q37_99_velha;q44_velha;q45_velha;q50_velha;d_40_1;d_40_2;d_40_3;d_40_4;d_41_1;d_41_2;d_41_3;d_41_4;d_42;d_51_9bin1_sum;d_51_9bin2_sum;d_51_9bin3_sum;d_51_10bin1_sum;d_51_10bin2_sum;d_51_10bin3_sum;d_51_10bin4_sum;d_51_10bin5_sum;d_51_11bin1_sum;d_51_11bin2_sum;d_51_11bin3_sum;d_51_11bin4_sum;nu_trabalhador;d_51_15_1bin_Gestão_sum;d_51_15_1bin_Gestão_do_SUAS_sum;d_51_15_1bin_Vigilância_Socioassistencial_sum;d_51_15_1bin_Gestão_do_Trabalho_sum;d_51_15_1bin_Regulação_do_SUAS_sum;d_51_15_1bin_Gestão_Financeira_Orçamentária_sum;d_51_15_1bin_PSB_sum;d_51_15_1bin_PSE_Média_Complexidade_sum;d_51_15_1bin_PSE_Alta_Complexidade_sum;d_51_15_1bin_Gestão_CadÚnico_sum;d_51_15_1bin_PBF_sum;d_51_15_1bin_Gestão_Benefícios_Assistenciais_sum;d_51_15_1bin_PCF_sum;d_51_15_1bin_Outros_sum;d_51_16_2bin_Gestão_sum;d_51_16_2bin_Gestão_do_SUAS_sum;d_51_16_2bin_Vigilância_Socioassistencial_sum;d_51_16_2bin_Gestão_do_Trabalho_sum;d_51_16_2bin_Regulação_do_SUAS_sum;d_51_16_2bin_Gestão_Financeira_Orçamentária_sum;d_51_16_2bin_PSB_sum;d_51_16_2bin_PSE_Média_Complexidade_sum;d_51_16_2bin_PSE_Alta_Complexidade_sum;d_51_16_2bin_Gestão_CadÚnico_sum;d_51_16_2bin_PBF_sum;d_51_16_2bin_Gestão_Benefícios_Assistenciais_sum;d_51_15_2bin_PCF_sum;d_51_16_2bin_Outros_sum;d_51_17_3bin_Gestão_sum;d_51_17_3bin_Gestão_do_SUAS_sum;d_51_17_3bin_Vigilância_Socioassistencial_sum;d_51_17_3bin_Gestão_do_Trabalho_sum;d_51_17_3bin_Regulação_do_SUAS_sum;d_51_17_3bin_Gestão_Financeira_Orçamentária_sum;d_51_17_3bin_PSB_sum;d_51_17_3bin_PSE_Média_Complexidade_sum;d_51_17_3bin_PSE_Alta_Complexidade_sum;d_51_17_3bin_Gestão_CadÚnico_sum;d_51_17_3bin_PBF_sum;d_51_17_3bin_Gestão_Benefícios_Assistenciais_sum;d_51_17_3bin_PCF_sum;d_51_17_3bin_Outros_sum;d_51_Gestão_sum;d_51_Gestão_do_SUAS_sum;d_51_Vigilância_Socioassistencial_sum;d_51_Gestão_do_Trabalho_sum;d_51_Regulação_do_SUAS_sum;d_51_Gestão_Financeira_Orçamentária_sum;d_51_PSB_sum;d_51_PSE_Média_Complexidade_sum;d_51_PSE_Alta_Complexidade_sum;d_51_Gestão_CadÚnico_sum;d_51_PBF_sum;d_51_Gestão_Benefícios_Assistenciais_sum;d_51_PCF_sum;d_51_Outros_sum
11;Secretaria de Estado da Assistência e do Desenvolvimento Social;3;Farquar;2986;Complexo Rio Madeira, Prédio Paccás, 6º Andar;Pedrinhas;Entre Avenida Farquar;76801-348;PORTO VELHO;RO;casseasro@gmail.com;(69) 984914478;0;-69;-8.749.704.828.268.130;-6.391.043.186.187.740;2;0;0;0;1;1;0;1;0; ;1;1;2;2;1;1;1;1;2;1;2019; ;1; ;0; ; ; ;1; ; ; ; ; ;1;1;0;0;0;0;0;0;0;1;1;1;1;1;0;Mamãe cheguei;criança feliz +;prato fácil;amparo; ; ; ; ; ; ;0;0;0;0;0;0;0;0;0;1;1;0;0; ;1; ; ; ; ; ; ; ; ; ;0;1;1;1;0;0;0;0;0;0;0;0; ;0; ; ; ; ; ; ; ; ; ; ; ; ; ; ; ;1;0;1;0;0;0;0;0;0;0;1;1;1;1;1;0;1;0;1;1;0;0; ;Encontro da vigilância Socioassistencial, capacitação PCF, Apoio técnico proteções básica e especial, Apoio Técnico Plano Municipal, Apoio Técnico Diagnostico Socioassistencial, Apoio técnicos Regionalizado as Proteção Social Básica e Especial, Capacitação Cadastro Único,;0; ; ; ; ; ; ; ;6;6;2;2;1;1;1;1;2;2;0;0;1;1;1;1;1;4;1;2;2;1;1;1;0;0;0;0;0;0;1;1;1;0;1;1;0; ;0;1;1;0;0; ;1;1;44;1;30;1;185;1;470;0; ;0; ;0; ;0; ;0; ;0; ; ; ;0; ; ; ; ;0; ; ; ; ;0; ;0;0;0; ;11;1; ;0;0;1;0;0;0;0;0;1;1;0;0;0;0;0;0;0;1;1;0;0;0;0;0;0;0;0;0;1;1;0;0;1;0;0;0;0;0;0;0;0;0;0;1;1;1;0;0;0;0;0;0;0; ; ; ; ; ; ; ; ; ; ; ; ; ; ;0;1;0;0;0;0;0;0;0; ; ; ; ; ; ;1;1;1;1;0;0;0;0;0;0;1;1;1;0;1;1;0; ; ; ;4;4;4;4;1;1;1;1;1; ;1;24; ;15; ;2;3;5; ;20; ;25; ; ; ; ; ; ; ; ; ; ; ; ; ; ; ; ; ; ; ; ; ; ; ; ; ; ; ; ; ; ; ; ; ; ; ; ; ; ; ; ; ; ; ; ; ; ; ; ; ; ; ; ; ; ; ; 
12;Secretaria de Estado de Assistência Social, dos Direitos Humanos e de Políticas para Mulheres - SEASDHM;3;NAÇÕES UNIDAS;2731; ;ESTAÇÃO EXPERIMENTAL; ;69918-172;RIO BRANCO;AC;gabinete.seasdhm@gmail.com;(68) 32287580; ;-68;-9.967.994.692.391.680;-6.783.245.444.297.790;2;0;0;0;0;1;0;1;1;mulheres;1;1;1;1;1;1;1;1;1;1;2020; ;0; ;0; ; ; ;1; ; ; ; ; ;1;1;0;0;0;0;0;0;0;1;1;1;1;1;1;Programa auxilio do bem; ; ; ; ;programa moradia transitória; ; ; ; ;0;1;0;0;0;0;1;0;1;1;1;1;0; ;1; ; ; ; ; ; ; ; ; ;1;0;0;0;0;1;0;0;1;0;0;0; ;0; ; ; ; ; ; ; ; ; ; ; ; ; ; ; ;0; ; ; ; ; ; ; ; ; ;0;1;1;1;0;0;1;0;1;1;0;0; ;PMAS, Vigilância Socioassistencial, PBF, PCF, Serviços e Beneficios,;1;0;0;0;1;0; ;21;2;2;1;5;3;0;1;0;1;1;0;0;1;1;1;1;1;3;0;1;1;1;1;0;1;0;0;0;1;1;1;1;1;1;0;0;0; ;0;1;0;1;1;Trabalho na modalide Home Office;2;0; ;0; ;0; ;0; ;0; ;0; ;0; ;0; ;0; ;4;2; ;2018;0; ; ; ; ;0; ; ; ; ;1; ;0;0;0; ;12;1; ;0;0;1;0;0;0;0;0;1;1;0;0;0;0;0;0;0;1;1;0;1;0;0;0;0;1;0;1;1;1;1;0;1;0;0;0;0;0;0;0;0;0;1;0;0;0;0;1;0;0;1;0;0; ; ; ; ; ; ; ; ; ; ; ; ; ; ; ; ; ; ; ; ; ; ; ;0;0;0;1;0;21;1;1;1;0;1;0;0;0;1;1;1;1;1;1;0;0;0;2;2018; ;1;1;1;1;1;1;1;1;1;12;40;65;4;20; ;3;1;70; ;36;11;117; ; ; ; ; ; ; ; ; ; ; ; ; ; ; ; ; ; ; ; ; ; ; ; ; ; ; ; ; ; ; ; ; ; ; ; ; ; ; ; ; ; ; ; ; ; ; ; ; ; ; ; ; ; ; ; 
13;SECRETARIA DE ESTADO DE ASSISTÊNCIA SOCIAL;3;Darcy Vargas;77; ;Chapada;Em frente ao Amazonas Shopping;69050-020;MANAUS;AM;dgsuas@seas.am.gov.br;(92) 21217818;0;-92;-3.092.787.158.426.990;-60.022.476.017.475.100;1; ; ; ; ; ; ; ; ; ;1;1;1;1;1;1;1;1;1;1;2017; ;1; ;0; ; ; ;1; ; ; ; ; ;1;1;0;0;1;0;1; ; ; ; ;0;1;1;0;Auxílio Emergencial;Auxílio Estadual Enchente;Auxílio Estadual Permanente - Vale Card; ; ; ; ; ; ; ;0;1;1;0;1;0;1;0;1;1;1;1;0; ;1; ; ; ; ; ; ; ; ; ;1;0;1;0;0;0;0;0;0;0;0;0; ;0; ; ; ; ; ; ; ; ; ; ; ; ; ; ; ;0; ; ; ; ; ; ; ; ; ;1;0;0;1;0;0;1;0;1;1;1;0; ; ;0; ; ; ; ; ; ; ;6;6;2;4;3;4;2;1;1;0;1;0;1;1;1;1;1;8;0;2;2;0;1;1;1;0;0;0;1;1;1;1;1;1;0;1;1;Auxílio Enchente, Programa Auxílio Estadual Pemanente;0;1;1;0;0; ;1;1;963;1;2;1;899;1;2447;0; ;0; ;0; ;0; ;0; ;3;2; ;2014;0; ; ; ; ;0; ; ; ; ;1; ;5;4;0; ;13;1; ;0;0;1;0;0;0;0;0;1;1;0;0;1;0;1;0;0;0;0;0;1;1;0;1;0;1;0;1;1;1;1;0;1;0;0;0;0;0;0;0;0;0;1;0;1;0;0;0;0;0;0;0;0; ; ; ; ; ; ; ; ; ; ; ; ; ; ; ; ; ; ; ; ; ; ; ; ; ; ; ; ; ;1;0;1;1;1;0;0;0;1;1;1;1;1;1;0;1;1;2;2014; ;5;2;5;6;1;1;1;1;1;20;103;167;4;61; ;6;27;73;96;96;25;290; ; ; ; ; ; ; ; ; ; ; ; ; ; ; ; ; ; ; ; ; ; ; ; ; ; ; ; ; ; ; ; ; ; ; ; ; ; ; ; ; ; ; ; ; ; ; ; ; ; ; ; ; ; ; ; 
14;SECRETARIA DE ESTADO DO TRABALHO E BEM-ESTAR SOCIAL;3;MARIO HOMEM DE MELO;2310;não tem;MECEJANA;ao lado da escola Estadual Ana Libória;69304-350;BOA VISTA;RR;gabinetesetrabes@gmail.com;(95) 21212630;2632;(95) 21212640;28.225.414.182.655.900;-60.694.149.971.532.100;2;0;0;0;0;1;1;0;0; ;0;1;2;1;1;1;1;2;1;2; ;1;1; ;0; ; ; ;1;0;0;0;1;0;0;1;0;0;0;0;0;1;1;0;0;1;1;1;0;PROGRAMA RENDA CIDADÃ;PROGRAMA EMERGENCIAL CESTA DA FAMILIA;PROGRAMA COLO DE MÃO;PROGRAMA MORAR MELHOR; ; ; ; ; ; ;0;0;0;1;0;0;0;1;0;0;1;0;0; ;0;0;0;0;0;1;0;0;0; ;1;0;0;0;0;1;1;0;0;0;0;0; ;1;0;1; ;8;1;1;1;0;0;0;1;1;1;0; ;1;1;1;0;1;1;0;0;0;0;1;1;1;1;0;0;1;0;0;1;1;0; ;Oficina de Planejamento, Orçamentario e Financeiro do SUAS;1;0;0;0;1;1;CPF;8;6;6;3;3;2;2;0;0;0;0;1;1;1;1;1;0;1;3;0;6;0;1;1;0;1;0;0;0;0;1;1;0;0;1;0;0;0; ;0;1;1;0;0; ;1;0; ;0; ;0; ;0; ;0; ;0; ;0; ;0; ; ;1;1;2; ;2016;0; ; ; ; ;0; ; ; ; ;2; ;0;1;0; ;14;1; ;0;0;1;0;0;0;1;0;0;1;0;0;0;0;0;1;1;0;0;0;0;0;1;0;0;0;1;0;0;1;0;0;0;0;0;0;0;1;0;0;0;0;1;0;0;0;0;1;1;0;0;0;0;0;1; ;8;1;1;1;0;0;0;1;1;1;0;1;1;0;1;1;0;0;0;0;0;0;0;1;1;8;1;1;1;0;1;0;0;0;0;1;1;0;0;1;0;0;0;2;2016; ;1;1;1;1;1;1;1;1;7;91;377;353;38;57;1;11;30;463;4;206;148;821; ; ; ; ; ; ; ; ; ; ; ; ; ; ; ; ; ; ; ; ; ; ; ; ; ; ; ; ; ; ; ; ; ; ; ; ; ; ; ; ; ; ; ; ; ; ; ; ; ; ; ; ; ; ; ; 
15;SECRETARIA DE ESTADO  DE ASSISTÊNCIA SOCIAL, TRABALHO, EMPREGO E RENDA;3;GOVERNADOR JOSÉ MALCHER;1018;entre a Alameda Joaquim Nabuco e Av. Wandecolk;NAZARÉ;PANIFICADORA METROPOLE;66055-260;BELEM;PA;seasterpa@yahoo.com.br;(91) 32391414; ;(91) 32196304;-14.505.822.707.055.100;-4.848.445.125.969.250;2;0;0;0;0;1;1;0;0; ;0;2;2;0;1;2;2;2;2;2; ;1;1; ;0; ; ; ;1; ; ; ; ; ;1;1;0;0;1;0;0;0;0;1;1;1;1;1;0;BPAH;Renda Pará;Vale Gás; ; ; ; ; ; ; ;0;0;0;1;0;0;0;0;1;1;1;1;0; ;0;1;0;1;1;0;0;0;1;Não temos acesso ao REALCAD, SIBEC, V7;1;0;1;1;1;1;0;0;1;0;0;0; ;1;0;1; ;23;1;1;1;0;0;0;1;1;1;0; ;1;0;0;0;0;1;0;0;0;0;0;1;1;1;0;1;0;0;0;1;0;1;Operadores do SUAS;Reunião técnica remota, Implantação e implementação da Vigilância Socioassistencial, Reunião on line de apoio técnico e escuta, Lives com os municípios com a dificuldade da utilização dos recursos nas ações estratégicas do Programa de Erradicação do Trabalho Infantil, Encontro informativo para o aprimoramento dos serviços em unidade de longa permanência para pessoas idosas, 3º Encontro Estadual de Vigilância Socioassistencial, 1º Webnário e Seminário de diálogos construtivos para a primeira infância da Amazônia paraense, Webnário de enfrentamento da violência sexual contra criança e adolescente - Desafios e estratégias das politicas sociais em tempos de pandemia, Webnário Pará em ação para eliminação do trabalho infantil, Lançamento do Plano Estadual de Enfrentamento da Violência sexual contra crianças e adolescentes,;0; ; ; ; ; ; ; ;7;7;2;2;2;2;1;1;1;1;1;1;1;1;1;0;1;5;0;3;3;1;1;1;1;0;0;0;0;0;1;1;0;0;0;0;0; ;0;1;1;1;0; ;1;0; ;0; ;1;42;1;65;0; ;0; ;0; ;0; ; ;1;0; ; ; ;0; ; ; ; ;0; ; ; ; ;1; ;0;0;0; ;15;1; ;0;0;1;0;0;0;0;0;1;1;0;0;1;0;0;0;0;1;1;0;0;0;1;0;0;0;0;1;1;1;1;0;0;1;0;1;1;0;0;0;1;0;1;0;1;1;1;1;0;0;1;0;0;0;1; ;23;1;1;1;0;0;0;1;1;1;0;0;0;0;0;1;0;0;0;0; ; ; ; ; ; ;1;1;1;1;1;0;0;0;0;0;1;1;0;0;0;0;0; ; ; ;1;1;4;4;1;1;1;1;7; ;9;140;12;74; ;3;14;114; ;29;6;149; ; ;11;5; ;3;16;8;13;13; ;80; ; ; ; ;11;5; ;3;16;8;13;13; ;80; ; ; ; ;11;5; ;3;16;8;13;13; ;80; ; ; ; ;11;5; ;3;16;8;13;13; ;80; ; 
16;Secretaria de Estado da Inclusão e Mobilização Social;3;Rio Vila Nova;6; ;Central; ;68900-092;MACAPA;AP;sims@sims.ap.gov.br;(96) 00000000; ;-96;0.02936616411383297;-5.105.317.443.609.230;2;0;0;0;0;1;0;0;0; ;2;2;2;2;2;1;1;2;2;2; ;1;0; ;0; ; ; ;1; ; ; ; ; ;1;1;0;0;1;0;0;0;0;1;1;1;1;1;1;Programa Renda Para Viver Melhor; ; ; ; ;Programa Amapá Jovem; ; ; ; ;0;0;1;1;1;0;1;0;0;1;1;1;0; ;0;0;0;1;0;1;0;1;0; ;1;0;1;1;1;0;1;0;0;1;0;0; ;0; ; ; ; ; ; ; ; ; ; ; ; ; ; ; ;0; ; ; ; ; ; ; ; ; ;0;1;1;1;1;0;0;0;1;0;0;0; ;Apoio técnico para averiguação do cumprimento do art, 30 da LOAS, Apoio técnico ao Censo SUAS 2021,;0; ; ; ; ; ; ; ;6;6;2;2;1;1;1;1;1;1;1;1;0; ;1;1;1;8;0;4;4;1;1;1;1;0;0;0;0;1;1;1;1;0;0;1;1;Antecipou o recurso do benefício eventual, sem a prestação de contas de outros anos anteriores devido à calamidade pública;0;0;0;0;1;Jornada de trabalho reduzida, com teletrabalho em alguns casos;1;0; ;0; ;0; ;0; ;0; ;0; ;0; ;0; ;0; ;0; ; ; ;0; ; ; ; ;0; ; ; ; ;1; ;36;21;0; ;16;1; ;0;0;1;0;0;0;0;0;1;1;0;0;1;0;0;0;0;1;1;0;0;1;1;1;0;1;0;0;1;1;1;0;0;0;0;1;0;1;0;1;0;0;1;0;1;1;1;0;1;0;0;1;0; ; ; ; ; ; ; ; ; ; ; ; ; ; ; ; ; ; ; ; ; ; ; ; ; ; ; ; ; ; ;1;1;1;1;0;0;0;0;1;1;1;1;0;0;1;1; ; ; ;1;1;1;1;1;1;1;1;1;39;65;140;5;32; ;1;6;137; ;75;32;244; ; ; ; ; ; ; ; ; ; ; ; ; ; ; ; ; ; ; ; ; ; ; ; ; ; ; ; ; ; ; ; ; ; ; ; ; ; ; ; ; ; ; ; ; ; ; ; ; ; ; ; ; ; ; ; 
17;SECRETARIA DO TRABALHO E DESENVOLVIMENTO SOCIAL;27;Esplanada das Secretarias Praça dos Girassois;0; ;centro; ;77001-002;PALMAS;TO;gabinetesetasto@gmail.com;(63) 32181926; ;(63) 32181988;-10.172.811.125.629.000;-4.833.471.536.636.350;2;0;0;0;0;0;1;0;1;Inclusão Produtiva, Segurança Alimentar;1;2;2;0;2;1;1;1;1;2; ;1;1; ;0; ; ; ;1; ; ; ; ; ;1; ; ; ; ;1;1; ; ; ; ;0;0; ; ; ; ; ; ; ; ; ; ; ; ;0;1;0;1;1;1;1;1;1;1;1;1;0; ;0;0;0;0;0;1;0;0;0; ;1;0;0;0;0;1;1;0;0;0;0;0; ;1;1;0;1; ;1;1;1;0;0;0;0;1;1;0; ;1;0;0;0;0;0;0;0;0;1;0;0;0;1;1;0;1;0;1;0;0;0; ; ;0; ; ; ; ; ; ; ;8;8;6;6;0;1;0;0;1;0;1;1;1;1;1;1;1;7;0;5;5;1;1;0;1;0;0;0;0;1;0;0;1;0;0;0;0; ;0;1;1;0;0; ;2;0; ;0; ;0; ;0; ;0; ;0; ;0; ;0; ;0; ;3;99;Secretaria da Administração;2012;0; ; ; ; ;0; ; ; ; ;1; ;0;0;0; ;17;1; ;0;0;1;0;0;0;0;0;1;0;0;0;0;1;1;0;0;0;0;0;1;0;1;1;1;1;1;1;1;1;1;0;0;0;0;0;0;1;0;0;0;0;1;0;0;0;0;1;1;0;0;0;0;1;0;1; ;1;1;1;0;0;0;0;1;1;0;0;0;0;0;0;0;0;0;1; ; ; ; ; ; ;1;1;1;0;1;0;0;0;0;1;0;0;1;0;0;0;0;99;2012; ;1;1;1;1;1;1;1;1;1;1;27;77;7;26; ;2;2;56; ;33;16;105;2;9;2; ; ;2;12;11;1;9;6;51; ; ;2;9;2; ; ;2;12;6;6;9;5;52; ; ;2;9;2; ; ;2;12;4;8;9;5;51; ; ;2;9;2; ; ;2;12;11;8;9;6;52; ; 
21;SECRETARIA DE ESTADO DE DESENVOLVIMENTO SOCIAL;32;DAS GARDÊNIAS, QUADRA 01;25; ;JARDIM RENASCENÇA;PLANTA TOWER , OFICE TOWER;65075-080;SAO LUIS;MA;saas100@outlook.com;(98) 20169200; ;-98;-24.916.730.745.567.100;-44.295.458.793.640.100;2;0;0;0;0;1;0;0;0; ;1;1;2;2;1;1;1;1;1;2;2021; ;0; ;1;2021; ; ;1;1;0;1;1;0;0;1;0;0;1;0;0;0;0;1;0;1;1;1;0;Programa Viva Água;Programa Bolsa Escola;Programa Vale Gás; ; ; ; ; ; ; ;0;1;1;1;1;0;0;1;1;1;1;1;0; ;0;1;0;0;0;1;0;1;0; ;1;0;1;1;0;1;1;0;0;0;0;0; ;1;1;1;12;0;1;1;1;1;1;1;1;1;1;0; ;0; ; ; ; ; ; ; ; ; ;1;1;1;1;1;1;1;1;1;1;1;0; ;Gestão do SUAS: Gestores 2021/2024, Oficina de Indicadores Sociais, Financiamento e Orçamento da Assistência Social, Vigilância e Execução dos Serviços Socioassistenciais, PPA 2022-2025, Art, 30 da LOAS e Instrumentos de Gestão, Educação Permanente do SUAS, Gestão e Execução da Política de Assistência Social, Proteção Social Básica: Programa Primeira Infância no SUAS, Sistema e-PCF, Serviço de Convivência e Fortalecimento de Vínculos e suas interfaces, BPC na Escola, Curso Guia de Visita Domiciliar PISUAS/PCF, Mês da Primeira Infância, Proteção Social Especial: Temáticas: Trabalho Infantil e Trabalho Escravo, Serviços de Acolhimento Institucional e Familiar de Crianças e Adolescentes, Serviço de Acolhimento em Residência Inclusiva,,;1;1;1;1;1;0; ;1;6;6;2;2;1;1;1;1;1;1;1;1;1;1;1;1;1;5;0;5;5;1;0;0;1;0;0;0;0;0;0;1;1;1;0;0;0; ;0;1;1;1;0; ;1;0; ;0; ;1;1921;0; ;1;16;0; ;1;166;0; ;1252; ;1;2; ;2015;0; ; ; ; ;0; ; ; ; ;1; ;1;3;0; ;21;2; ;0;0;1;1;0;1;1;0;0;1;0;0;1;0;0;0;0;1;0;0;1;1;1;1;0;0;1;1;1;1;1;0;0;1;0;0;0;1;0;1;0;0;1;0;1;1;0;1;1;0;0;0;0;1;1;12;0;1;1;1;1;1;1;1;1;1;0; ; ; ; ; ; ; ; ; ;1;1;1;1;0;1;1;1;0;0;1;0;0;0;0;0;0;1;1;1;0;0;0;2;2015; ;1;1;6;1;4;1;4;1;6; ;13;58;7;34; ;3;3;27;4;24;16;71; ; ; ; ; ; ; ; ; ; ; ; ; ; ; ; ; ; ; ; ; ; ; ; ; ; ; ; ; ; ; ; ; ; ; ; ; ; ; ; ; ; ; ; ; ; ; ; ; ; ; ; ; ; ; ; 
22;SECRETARIA DA ASSISTENCIA SOCIAL, TRABALHO E DIREITOS HUMANOS - SASC;32;ACRE;340; ;CABRAL;PROXIMO A ASSEMBLEIA LEGISLATIVA;64001-650;TERESINA;PI;sasc@sasc.pi.gov.br;(86) 32264880; ;(86) 32217126;-5.080.185.439.245.900;-4.279.929.041.862.480;2;0;0;0;0;1;1;1;0; ;1;1;1;1;1;1;1;1;1;1; ;1;0; ;0; ; ; ;1;0;0;1;0;0;0;1;0;0;0;0;0;0;0;1;1;0;1;1;0;Passe livre Inter-municipal da pessoa idosa;Qualifica Piauí;Cartão Sasc EMERGENCIAL;Cartão pró social; ; ; ; ; ; ;0;1;1;1;1;1;1;1;1;1;1;1;0; ;0;0;0;1;0;1;0;0;0; ;1;0;0;0;0;0;1;0;1;0;0;0; ;1;0;1; ;23;1;1;1;1;1;1;1;1;1;0; ;1;1;1;0;0;1;0;0;0;0;1;1;1;1;0;0;1;0;1;1;0;0; ;Sobre o artigo 30 da LOAS, e cadastro único,,;1;0;1;1;1;0; ;81;6;6;2;2;1;1;1;1;2;2;0;0;0; ;1;1;1;3;0;5;5;1;0;1;1;0;0;0;0;1;0;1;0;0;0;1;0; ;0;1;1;1;0; ;1;0; ;0; ;1;131;0; ;0; ;0; ;0; ;0; ; ;1;0; ; ; ;0; ; ; ; ;0; ; ; ; ;1; ;2;3;0; ;22;2; ;0;0;1;0;0;1;0;0;0;1;0;0;0;0;0;0;0;1;1;0;1;1;1;1;1;1;1;1;1;1;1;0;0;0;0;1;0;1;0;0;0;0;1;0;0;0;0;0;1;0;1;0;0;0;1; ;23;1;1;1;1;1;1;1;1;1;0;1;1;0;0;1;0;0;0;0;0;1;1;1;0;81; ;1;0;1;1;0;0;0;0;1;0;1;0;0;0;1;0; ; ; ;1;1;4;1;1;1;1;1;7; ;1;34;2;20; ;2;3;13; ;15;7;35; ; ; ; ; ; ; ; ; ; ; ; ; ; ; ; ; ; ; ; ; ; ; ; ; ; ; ; ; ; ; ; ; ; ; ; ; ; ; ; ; ; ; ; ; ; ; ; ; ; ; ; ; ; ; ; 
23;Secretaria de Proteção Social, Justiça, Cidadania ,Mulheres e Direitos Humanos;32;SORIANO ALBUQUERQUE;230; ;Joaquim Távora;PRÉDIO DA ANTIGA L.B.A.;60130-160;FORTALEZA;CE;gabinete@sps.gov.br;(85) 31014597;2121;(85) 31012121;-37.498.249;-385.126.148;2;0;0;0;0;1;0;1;1;Justiça e Cidadania,;1;1;1;1;1;1;1;1;1;2;2021; ;1; ;0; ;1;0;0;1;0;1;0;0;0;1;0;0;0;0;1; ; ; ; ;1;1;1;1;CARTÃO MAIS INFÂNCIA CEARÁ-CEMIC; ; ; ; ;ESPAÇO VIVA GENTE;POLOS DE CONVIVÊNCIA SOCIAL(ABC'S;FAMILIA-DESAFIOS INCLUSÃO SOCIAL; ; ;0;1;1;1;1;1;0;1;1;1;1;1;1;Disseminção de informações por meio de grupos de whatsaps,elaboração de informes e notas técnica,;0;1;0;0;0;1;0;1;1;As informações não são repassadas ao Estadopara que possamos orientar os municípios,;1;1;1;1;0;1;1;0;1;0;1;0;Realizou reuniões técnicas/elaboração de informes sobre o auxilio, realizou assessoramento técnico emergencial,;1;1;0;2; ;0;0;0;0;0;0;0;0;0;1;Não executa modelo II(pra fechar a questão tive que marcar esta,;1;1;1;0;1;1;0;0;0;0;1;1;1;1;1;1;1;0;1;1;0;1;Nota técnica,cartilhas,nota circular0;Como trabalhar de forma remota nos CRAS, como ofertar o SCFV de forma remota, orientações /esclarecimentos sobre: nota técnica ° 100/Snas,Cmic, Be,etc, Oficina: Orientações técnicas sobre o serviço de acolhimento para Crianças e Adolescentes no município de Ararendá, oficina : dialogando com a Rede, oficina sobre a interlocução entre Paefi e serviço de acolhimento, Oficina: Conselheiros Tutelares e a Proteção Social na Perspectiva do SUAS, nivelamento entre os Creas Regionais I (Cariri) e Creas Regional II (Fortaleza), Oficina sobre o CEMARIS( Censo e mapa de riscos social e pessoal),Orientação sobre o preenchimento do censo suas 2021, Webinário sobre os Procedimentos e Responsabilidades no Processo de Transição da Gestão Municipal, Seminário Estadual Sobre a Politica de Assistência Social e INSS,e outras,;1;1;1;1;1;0; ;35;6;6;2;2;1;1;1;1;1;1;1;1;0; ;1;1;1;11;0;7;7;0;0;1;1;0;0;0;0;1;0;0;1;0;0;0;1;Vale gás,cesta básica, epis,;1;1;1;1;0; ;1;1;171;0; ;1;694;1;1222;1;50;0; ;0; ;1;173;0; ;0; ; ; ;0; ; ; ; ;0; ; ; ; ;1; ;3;3;0; ;23;2; ;1;0;0;1;0;1;0;0;0;1;0;0;0;0;1;0;0;0;0;0;1;1;1;1;1;0;1;1;1;1;1;1;0;1;0;0;0;1;0;1;1;0;1;1;1;1;0;1;1;0;1;0;1;1;0;2; ;0;0;0;0;0;0;0;0;0;1;1;1;0;1;1;0;0;0;0;1;1;1;1;0;35; ;0;0;1;1;0;0;0;0;1;0;0;1;0;0;0;1; ; ; ;4;1;5;6;4;1;1;4;1;64;164;217;28;48; ;18;10;112;46;9;278;445; ;2;1; ; ; ; ; ; ; ; ; ; ; ; ;1; ; ; ; ; ; ; ; ; ;1; ; ; ; ; ; ; ; ; ; ; ; ; ; ; ; ; ;3;1; ; ; ; ; ; ; ; ;1; ; 
24;SECRETARIA ESTADUAL DO TRABALHO DA HABITACAO E DA ASSISTENCIA SOCIAL;3;SENADOR SALGADO FILHO;0; ;LAGOA NOVA;CENTRO ADMINISTRATIVO DO ESTADO;59064-901;NATAL;RN;expediente.sethas@gmail.com;(84) 32321850;1806;-84;-5.827.897.311.328.830;-35.213.987.231.254.500;2;0;0;0;1;0;1;0;0; ;2;2;2;2;2;2;2;2;2;2; ;1;0; ;0; ; ; ;1; ; ; ; ; ;1;1;0;0;0;0;1; ; ; ; ;0;0; ; ; ; ; ; ; ; ; ; ; ; ;0;1;1;0;0;0;0;0;0;0;1;0;0; ;0;1;0;0;0;1;0;0;0; ;0;0;0;0;0;0;0;0;0;0;1;0;Programa RN Chega Junto no Combate à Fome;0; ; ; ; ; ; ; ; ; ; ; ; ; ; ; ;1;1;0;0;0;1;0;0;0;0;1;1;1;1;0;1;1;0;1;1;0;0; ;Seminário Potiguar de Atenção ao Envelhecimento Humano, Seminário Estadual de Combate ao Abuso e Exploração Sexual de Crianças e Adolescentes, Reunião de Sensibilização dos Municípios do RN para adesão ao Pacto Nacional da Pessoa Idosa, I Mês da Primeira Infância no SUAS, Agosto Lilás 2021 ? Mini Curso, II Jornada Virtual Especial do Agosto Lilás, Reuniões Territoriais: Casa de Acolhimento Anatália de Melo Alves, Webinário - O Trabalho Infantil no Sistema Único de Assistência Social: desafios no enfrentamento em tempos de pandemia, Jornada de acolhida dos novos gestores, CARTILHA: POVOS INDÍGENAS E DIREITOS SOCIOASSISTENCIAIS, JORNADA ESTADUAL: POVOS E COMUNIDADES TRADICIONAIS E GPTE's NO SUAS,  Orientações gerais da SETHAS/COGESUAS para transição dos gestores/as municipais de Assistência Social, I Ciclo de Reuniões Territoriais: Orientações sobre Elaboração de Planos Municipais e Diagnóstico Socioterritorial, 1ª Apoio Técnico Descentralizado Território Assú-Mossoró,;0; ; ; ; ; ; ; ;3;3;2;2;1;1;1;1;1;1;1;1;1;1;1;1;1;3;0;4;0;0;0;1;0;0;0;0;0;1;1;1;1;0;0;1;0; ;0;1;0;0;0; ;2;0; ;0; ;0; ;0; ;0; ;0; ;0; ;0; ;0; ;1;2; ;2010;0; ; ; ; ;0; ; ; ; ;1; ;2;0;0; ;24;2; ;0;0;1;0;0;0;0;0;1;1;0;0;0;0;1;0;0;0;0;0;1;1;0;0;0;0;0;0;0;1;0;0;0;1;0;0;0;1;0;0;0;0;0;0;0;0;0;0;0;0;0;0;1; ; ; ; ; ; ; ; ; ; ; ; ; ; ;1;0;0;0;1;0;0;0;0; ; ; ; ; ; ;1;0;0;1;0;0;0;0;0;1;1;1;1;0;0;1;0;2;2010; ;1;1;1;1;1;1;1;1;1;1;9;27; ;13; ;2;4;4;1;9;23;37; ; ; ; ; ; ; ; ; ; ; ; ; ; ; ; ; ; ; ; ; ; ; ; ; ; ; ; ; ; ; ; ; ; ; ; ; ; ; ; ; ; ; ; ; ; ; ; ; ; ; ; ; ; ; ; 
25;SECRETARIA DE ESTADO DO DESENVOLVIMENTO HUMANO;3;EPITÁCIO PESSOA;2501;0;Dos Estados;Em Frente a VIVO;58030-001;JOAO PESSOA;PB;tiberiolimeira@sedh.pb.gov.br;(83) 31334054; ;-83;-7.119.502.657.536.250;-3.484.788.179.398.090;2;0;0;0;0;1;1;1;1;Economia Solidária;1;1;1;1;1;1;1;1;2;2;2017; ;0; ;1;2015; ; ;1;1;1;1;1;1;0;1;0;1;0;0;0;1;0;1;1;1;1;1;0;Cartão Alimentação;Abono Natalino;Programa Prato Cheio;Programa Tá na Mesa;Paraíba que Acolhe; ; ; ; ; ;0;0;0;0;0;0;0;1;0;1;1;0;0; ;0;0;0;0;0;1;0;1;0; ;1;0;0;0;0;1;1;1;1;0;0;0; ;1;1;0;26; ;0;0;0;0;0;0;0;0;0;1;x;1;1;0;0;0;0;0;0;0;1;1;0;1;1;0;1;1;0;1;0;1;0; ;Assessora SUAS: A gestão do PBF, SIPIA CT, Criança e Adolescentes, Acesso a documentação básica, Orientações técnicas de execução de recursos e financiamentos, Parâmetro para Serviços de Acolhimento, Enfrentamento ao Tráfico de Seres Humanos, Família Acolhedora, PCF, Elaboração do Plano SINASE, dentre outros;0; ; ; ; ; ; ; ;7;7;3;4;1;2;1;0;1;0;0;0;1;1;1;0;1;10;0;7;7;0;1;0;1;0;0;0;1;1;1;1;1;1;0;1;0; ;0;1;1;1;0; ;1;1;134;0; ;0; ;0; ;0; ;0; ;0; ;0; ;0; ;0; ; ; ;0; ; ; ; ;0; ; ; ; ;2; ;0;0;0; ;25;2; ;0;0;1;1;1;1;1;1;0;1;0;1;0;0;0;1;0;1;1;0;0;0;0;0;0;0;1;0;1;1;0;0;0;0;0;0;0;1;0;1;0;0;1;0;0;0;0;1;1;1;1;0;0;1;0;26; ;0;0;0;0;0;0;0;0;0;1;1;0;0;0;0;0;0;0;1; ; ; ; ; ; ;1;0;1;0;1;0;0;0;1;1;1;1;1;1;0;1;0; ; ; ;4;1;1;1;1;1;1;1;1; ;2;43;3;23; ;1;5;2; ;9;34;45; ; ; ; ; ; ; ; ; ; ; ; ; ; ; ; ; ; ; ; ; ; ; ; ; ; ; ; ; ; ; ; ; ; ; ; ; ; ; ; ; ; ; ; ; ; ; ; ; ; ; ; ; ; ; ; 
26;SECRETARIA ESTADUAL DE DESENVOLVIMENTO SOCIAL, CRIANÇA E JUVENTUDE;3;CRUZ CABUGÁ;665;0;SANTO AMARO;Palácio Frei Caneca - Antiga Vice-Governadoria;50040-000;RECIFE;PE;sdscj@sdscj.pe.gov.br;(81) 31833000;3001;(81) 31833007;-8.044.081.124.757.110;-34.874.639.511.108.400;2;0;0;0;0;0;0;0;1;Criança e Juventude;1;1;1;0;1;1;1;1;1;1; ;1;1; ;0; ; ; ;1; ; ; ; ; ;1;1;0;0;0;0;0;0;0;1;1;1;1;1;0;13º do Bolsa Família de Pernambuco;Benefício Continuado Pernambuco Protege;Chapéu de Palha;Programa Pernambuco no Batente;Cozinhas Comunitárias; ; ; ; ; ;0;1;1;1;1;0;0;1;0;1;1;1;0; ;0;0;0;0;0;1;0;0;0; ;1;0;0;0;0;1;1;0;0;0;1;0;Benefício Eventual aos Trabalhadores do Litoral de Pernambuco;0; ; ; ; ; ; ; ; ; ; ; ; ; ; ; ;0; ; ; ; ; ; ; ; ; ;0;1;1;1;1;1;1;1;1;1;1;0; ;1- Reunião Apoio Técnico - cumprimento artigo 30 LOAS, 2- Apoio Técnico atuação em situação de Calamidade, 3- Apoio Técnico Construção do Plano Municipal de Assistência Social, 4- Diálogos municipais sobre so Serviços Socioassistenciais em tempos de travessia da Pandemia, 5- Diálogos sobre interface e os compromissos das Políticas no Programa BPC na Escola;0; ; ; ; ; ; ; ;6;6;2;2;1;1;1;1;1;1;1;1;1;1;1;0;1;10;0;5;4;1;0;1;1;0;0;0;1;1;0;0;1;0;1;1;1;Concessão de Cestas Básicas e Compra local;0;1;1;1;0; ;1;1;40;1;26;1;530;1;1400;0; ;0; ;0; ;0; ;0; ;0; ; ; ;0; ; ; ; ;0; ; ; ; ;1; ;1;2;0; ;26;2; ;0;0;1;0;0;0;0;0;1;1;0;0;0;0;0;0;0;1;1;0;1;1;1;1;0;0;1;0;1;1;1;0;0;0;0;0;0;1;0;0;0;0;1;0;0;0;0;1;1;0;0;0;1; ; ; ; ; ; ; ; ; ; ; ; ; ; ; ; ; ; ; ; ; ; ; ; ; ; ; ; ; ;1;1;0;1;1;0;0;0;1;1;0;0;1;0;1;1;1; ; ; ;4;4;5;6;1;1;1;1;1;2;16;89;7;27; ;2;11;22;2;25;58;107; ; ; ; ; ; ; ; ; ; ; ; ; ; ; ; ; ; ; ; ; ; ; ; ; ; ; ; ; ; ; ; ; ; ; ; ; ; ; ; ; ; ; ; ; ; ; ; ; ; ; ; ; ; ; ; 
